ID,triple1,triple2,question,answer,inferred triple,label
1384,Cabestany arrondissement Perpignan.,arrondissement has domain UndergroundJournal.,"Given the previous statements, is Cabestany a PopulatedPlace?",No,Cabestany is not a PopulatedPlace.,False
1385,Cabrerets arrondissement Cahors.,arrondissement has domain Vaccine.,"Given the previous statements, is Cabrerets a PopulatedPlace?",No,Cabrerets is not a PopulatedPlace.,False
1386,Cachan arrondissement L'Haÿ-les-Roses.,arrondissement has domain MotorcycleRacingLeague.,"Given the previous statements, is Cachan a PopulatedPlace?",No,Cachan is not a PopulatedPlace.,False
1387,Callbach associationOfLocalGovernment Meisenheim.,associationOfLocalGovernment has domain VolleyballLeague.,"Given the previous statements, is Callbach a Settlement?",No,Callbach is not a Settlement.,False
1388,Calvörde associationOfLocalGovernment Flechtingen.,associationOfLocalGovernment has domain Youtuber.,"Given the previous statements, is Calvörde a Settlement?",No,Calvörde is not a Settlement.,False
1389,Pottum associationOfLocalGovernment Westerburg.,associationOfLocalGovernment has domain BasketballTeam.,"Given the previous statements, is Pottum a Settlement?",No,Pottum is not a Settlement.,False
1390,"Capital Beltway beltwayCity Washington, D.C..",beltwayCity has domain HistoricalPeriod.,"Given the previous statements, is Capital Beltway a Road?",No,Capital Beltway is not a Road.,False
1391,"Capital Beltway beltwayCity Harrisburg, Pennsylvania.",beltwayCity has domain Decoration.,"Given the previous statements, is Capital Beltway a Road?",No,Capital Beltway is not a Road.,False
1392,Pretoria Ring Road beltwayCity Pretoria.,beltwayCity has domain Tunnel.,"Given the previous statements, is Pretoria Ring Road a Road?",No,Pretoria Ring Road is not a Road.,False
1393,Cadillac High Technology engine blockAlloy Aluminum.,blockAlloy has domain Newspaper.,"Given the previous statements, is Cadillac High Technology engine an AutomobileEngine?",No,Cadillac High Technology engine is not an AutomobileEngine.,False
1394,Cadillac V8 engine blockAlloy Cast iron.,blockAlloy has domain Winery.,"Given the previous statements, is Cadillac V8 engine an AutomobileEngine?",No,Cadillac V8 engine is not an AutomobileEngine.,False
1395,Cadillac twin-turbo V8 blockAlloy Aluminum.,blockAlloy has domain HistoricalProvince.,"Given the previous statements, is Cadillac twin-turbo V8 an AutomobileEngine?",No,Cadillac twin-turbo V8 is not an AutomobileEngine.,False
1396,Cabbio canton Ticino.,canton has domain Parish.,"Given the previous statements, is Cabbio a Settlement?",No,Cabbio is not a Settlement.,False
1397,Cademario canton Ticino.,canton has domain Camera.,"Given the previous statements, is Cademario a Settlement?",No,Cademario is not a Settlement.,False
1398,Cadempino canton Ticino.,canton has domain Canoeist.,"Given the previous statements, is Cadempino a Settlement?",No,Cadempino is not a Settlement.,False
1399,"Campus School, CCS HAU chairperson Vice-Chancellor.",chairperson has domain Cave.,"Given the previous statements, is Campus School, CCS HAU an Organisation?",No,"Campus School, CCS HAU is not an Organisation.",False
1400,Carpathian German Party chairperson Franz Karmasin.,chairperson has domain Lymph.,"Given the previous statements, is Carpathian German Party an Organisation?",No,Carpathian German Party is not an Organisation.,False
1401,Professional Power chairperson Christine Fong.,chairperson has domain Cave.,"Given the previous statements, is Professional Power an Organisation?",No,Professional Power is not an Organisation.,False
1402,Calcalist chiefEditor Yoel Esteron.,chiefEditor has domain TopicalConcept.,"Given the previous statements, is Calcalist a Work?",No,Calcalist is not a Work.,False
1403,Calgary Sun chiefEditor Lorne Motley.,chiefEditor has domain MovieGenre.,"Given the previous statements, is Calgary Sun a Work?",No,Calgary Sun is not a Work.,False
1404,Canada's National Observer chiefEditor Karyn Pugliese.,chiefEditor has domain Fashion.,"Given the previous statements, is Canada's National Observer a Work?",No,Canada's National Observer is not a Work.,False
1405,Caitlin Mallory choreographer Marina Zoueva.,choreographer has domain IceHockeyLeague.,"Given the previous statements, is Caitlin Mallory a FigureSkater?",No,Caitlin Mallory is not a FigureSkater.,False
1406,Caitlin Mallory choreographer Igor Shpilband.,choreographer has domain Pharaoh.,"Given the previous statements, is Caitlin Mallory a FigureSkater?",No,Caitlin Mallory is not a FigureSkater.,False
1407,Caleb Wein choreographer Greg Zuerlein.,choreographer has domain Protocol.,"Given the previous statements, is Caleb Wein a FigureSkater?",No,Caleb Wein is not a FigureSkater.,False
1408,Caeleb Dressel club Cali Condors.,club has domain Outbreak.,"Given the previous statements, is Caeleb Dressel an Athlete?",No,Caeleb Dressel is not an Athlete.,False
1409,Caio Pumputis club Esporte Clube Pinheiros.,club has domain Writer.,"Given the previous statements, is Caio Pumputis an Athlete?",No,Caio Pumputis is not an Athlete.,False
1410,Caitlin McClatchey club University of Edinburgh.,club has domain Rower.,"Given the previous statements, is Caitlin McClatchey an Athlete?",No,Caitlin McClatchey is not an Athlete.,False
1411,Cadore Viaduct constructionMaterial Reinforced concrete.,constructionMaterial has domain Town.,"Given the previous statements, is Cadore Viaduct an ArchitecturalStructure?",No,Cadore Viaduct is not an ArchitecturalStructure.,False
1412,Caerhowel Bridge constructionMaterial Cast iron.,constructionMaterial has domain RailwayStation.,"Given the previous statements, is Caerhowel Bridge an ArchitecturalStructure?",No,Caerhowel Bridge is not an ArchitecturalStructure.,False
1413,Caledonian Railway Bridge constructionMaterial Steel.,constructionMaterial has domain Vodka.,"Given the previous statements, is Caledonian Railway Bridge an ArchitecturalStructure?",No,Caledonian Railway Bridge is not an ArchitecturalStructure.,False
1414,Cadillac High Technology engine coolingSystem Radiator.,coolingSystem has domain CanadianFootballTeam.,"Given the previous statements, is Cadillac High Technology engine an AutomobileEngine?",No,Cadillac High Technology engine is not an AutomobileEngine.,False
1415,Cadillac V8 engine coolingSystem Radiator.,coolingSystem has domain LineOfFashion.,"Given the previous statements, is Cadillac V8 engine an AutomobileEngine?",No,Cadillac V8 engine is not an AutomobileEngine.,False
1416,Cadillac twin-turbo V8 coolingSystem Radiator.,coolingSystem has domain Temple.,"Given the previous statements, is Cadillac twin-turbo V8 an AutomobileEngine?",No,Cadillac twin-turbo V8 is not an AutomobileEngine.,False
1417,Proton countryOrigin Soviet Union.,countryOrigin has domain ChristianBishop.,"Given the previous statements, is Proton a Rocket?",No,Proton is not a Rocket.,False
1418,Rocket Lab Neutron countryOrigin United States.,countryOrigin has domain FormulaOneTeam.,"Given the previous statements, is Rocket Lab Neutron a Rocket?",No,Rocket Lab Neutron is not a Rocket.,False
1419,Molniya countryOrigin Soviet Union.,countryOrigin has domain Name.,"Given the previous statements, is Molniya a Rocket?",No,Molniya is not a Rocket.,False
1420,Caitlin Mallory currentPartner Kristjan Rand.,currentPartner has domain MotorcycleRacingLeague.,"Given the previous statements, is Caitlin Mallory a FigureSkater?",No,Caitlin Mallory is not a FigureSkater.,False
1421,Caitlin Mallory currentPartner Brent Holdburg.,currentPartner has domain Guitar.,"Given the previous statements, is Caitlin Mallory a FigureSkater?",No,Caitlin Mallory is not a FigureSkater.,False
1422,Caitlin Yankowskas currentPartner Hamish Gaman.,currentPartner has domain Area.,"Given the previous statements, is Caitlin Yankowskas a FigureSkater?",No,Caitlin Yankowskas is not a FigureSkater.,False
1423,Cargolux destination List of Cargolux destinations.,destination has domain ChristianDoctrine.,"Given the previous statements, is Cargolux a PublicTransitSystem?",No,Cargolux is not a PublicTransitSystem.,False
1424,Caribbean Helicopters destination Saint Kitts and Nevis.,destination has domain Priest.,"Given the previous statements, is Caribbean Helicopters a PublicTransitSystem?",No,Caribbean Helicopters is not a PublicTransitSystem.,False
1425,Caribbean Helicopters destination Montserrat.,destination has domain Project.,"Given the previous statements, is Caribbean Helicopters a PublicTransitSystem?",No,Caribbean Helicopters is not a PublicTransitSystem.,False
1426,Pro Patria Union europeanParliamentGroup European People's Party group.,europeanParliamentGroup has domain GraveMonument.,"Given the previous statements, is Pro Patria Union a PoliticalParty?",No,Pro Patria Union is not a PoliticalParty.,False
1427,Progressive Party of Working People europeanParliamentGroup NGL.,europeanParliamentGroup has domain RaceTrack.,"Given the previous statements, is Progressive Party of Working People a PoliticalParty?",No,Progressive Party of Working People is not a PoliticalParty.,False
1428,Progressive Slovakia europeanParliamentGroup Renew Europe.,europeanParliamentGroup has domain Athletics.,"Given the previous statements, is Progressive Slovakia a PoliticalParty?",No,Progressive Slovakia is not a PoliticalParty.,False
1429,Calau federalState Brandenburg.,federalState has domain SoccerLeagueSeason.,"Given the previous statements, is Calau a Settlement?",No,Calau is not a Settlement.,False
1430,Calvörde federalState Saxony-Anhalt.,federalState has domain Bird.,"Given the previous statements, is Calvörde a Settlement?",No,Calvörde is not a Settlement.,False
1431,Calw federalState Baden-Württemberg.,federalState has domain Lawyer.,"Given the previous statements, is Calw a Settlement?",No,Calw is not a Settlement.,False
1432,Cable 14 formerBroadcastNetwork Shaw Communications.,formerBroadcastNetwork has domain Journalist.,"Given the previous statements, is Cable 14 a Broadcaster?",No,Cable 14 is not a Broadcaster.,False
1433,Cable 14 formerBroadcastNetwork Source Cable.,formerBroadcastNetwork has domain Infrastructure.,"Given the previous statements, is Cable 14 a Broadcaster?",No,Cable 14 is not a Broadcaster.,False
1434,Prairie Public Television formerBroadcastNetwork National Educational Television.,formerBroadcastNetwork has domain Skos.,"Given the previous statements, is Prairie Public Television a Broadcaster?",No,Prairie Public Television is not a Broadcaster.,False
1435,Caitlin Yankowskas formerCoach Johnny Johns.,formerCoach has domain Baronet.,"Given the previous statements, is Caitlin Yankowskas a FigureSkater?",No,Caitlin Yankowskas is not a FigureSkater.,False
1436,Caitlin Yankowskas formerCoach Alexander Vlassov.,formerCoach has domain Poet.,"Given the previous statements, is Caitlin Yankowskas a FigureSkater?",No,Caitlin Yankowskas is not a FigureSkater.,False
1437,Caitlin Yankowskas formerCoach Larry Ibarra.,formerCoach has domain Relationship.,"Given the previous statements, is Caitlin Yankowskas a FigureSkater?",No,Caitlin Yankowskas is not a FigureSkater.,False
1438,Caitlin Fields formerPartner Max Settlage.,formerPartner has domain RocketEngine.,"Given the previous statements, is Caitlin Fields a FigureSkater?",No,Caitlin Fields is not a FigureSkater.,False
1439,Caitlin Fields formerPartner Ernie Utah Stevens.,formerPartner has domain Magazine.,"Given the previous statements, is Caitlin Fields a FigureSkater?",No,Caitlin Fields is not a FigureSkater.,False
1440,Caitlin Fields formerPartner Sébastian Arcieri.,formerPartner has domain Engine.,"Given the previous statements, is Caitlin Fields a FigureSkater?",No,Caitlin Fields is not a FigureSkater.,False
1441,"Cambridge University Law Society head Brenda Hale, Baroness Hale of Richmond.",head has domain Vein.,"Given the previous statements, is Cambridge University Law Society an EducationalInstitution?",No,Cambridge University Law Society is not an EducationalInstitution.,False
1442,"Campion Hall, Oxford head Society of Jesus.",head has domain BrownDwarf.,"Given the previous statements, is Campion Hall, Oxford an EducationalInstitution?",No,"Campion Hall, Oxford is not an EducationalInstitution.",False
1443,Case Western Reserve University School of Law head Jessica Wilen Berg.,head has domain TrainCarriage.,"Given the previous statements, is Case Western Reserve University School of Law an EducationalInstitution?",No,Case Western Reserve University School of Law is not an EducationalInstitution.,False
1444,Cadillac High Technology engine headAlloy Cast iron.,headAlloy has domain CultivatedVariety.,"Given the previous statements, is Cadillac High Technology engine an AutomobileEngine?",No,Cadillac High Technology engine is not an AutomobileEngine.,False
1445,Cadillac V8 engine headAlloy Aluminium.,headAlloy has domain EducationalInstitution.,"Given the previous statements, is Cadillac V8 engine an AutomobileEngine?",No,Cadillac V8 engine is not an AutomobileEngine.,False
1446,Cadillac V8 engine headAlloy Cast iron.,headAlloy has domain RomanEmperor.,"Given the previous statements, is Cadillac V8 engine an AutomobileEngine?",No,Cadillac V8 engine is not an AutomobileEngine.,False
1447,"Caldew homeport Portsmouth, England.",homeport has domain Monastery.,"Given the previous statements, is Caldew a Ship?",No,Caldew is not a Ship.,False
1448,"Californian homeport San Diego, California.",homeport has domain MotorRace.,"Given the previous statements, is Californian a Ship?",No,Californian is not a Ship.,False
1449,Cap San Diego homeport Hamburg.,homeport has domain Fungus.,"Given the previous statements, is Cap San Diego a Ship?",No,Cap San Diego is not a Ship.,False
1450,Cabot Strait inflow Atlantic ocean.,inflow has domain Swimmer.,"Given the previous statements, is Cabot Strait a BodyOfWater?",No,Cabot Strait is not a BodyOfWater.,False
1451,Caburgua Lake inflow Blanco River.,inflow has domain AcademicJournal.,"Given the previous statements, is Caburgua Lake a BodyOfWater?",No,Caburgua Lake is not a BodyOfWater.,False
1452,Cachisca Lake inflow Opataca Lake.,inflow has domain CricketLeague.,"Given the previous statements, is Cachisca Lake a BodyOfWater?",No,Cachisca Lake is not a BodyOfWater.,False
1453,Cambodia National Rescue Movement internationalAffiliation Liberal International.,internationalAffiliation has domain Mollusca.,"Given the previous statements, is Cambodia National Rescue Movement a PoliticalParty?",No,Cambodia National Rescue Movement is not a PoliticalParty.,False
1454,Cambodia National Rescue Party internationalAffiliation Liberal International.,internationalAffiliation has domain Place.,"Given the previous statements, is Cambodia National Rescue Party a PoliticalParty?",No,Cambodia National Rescue Party is not a PoliticalParty.,False
1455,Canadian Nazi Party internationalAffiliation World Union of National Socialists.,internationalAffiliation has domain Crater.,"Given the previous statements, is Canadian Nazi Party a PoliticalParty?",No,Canadian Nazi Party is not a PoliticalParty.,False
1456,Cajun launchSite Churchill Rocket Research Range.,launchSite has domain Guitar.,"Given the previous statements, is Cajun a SpaceMission?",No,Cajun is not a SpaceMission.,False
1457,Cajun launchSite Wallops Flight Facility.,launchSite has domain TradeUnion.,"Given the previous statements, is Cajun a SpaceMission?",No,Cajun is not a SpaceMission.,False
1458,Cajun launchSite Eglin AFB.,launchSite has domain Novel.,"Given the previous statements, is Cajun a SpaceMission?",No,Cajun is not a SpaceMission.,False
1459,Caltanissetta leaderName Roberto Gambino.,leaderName has domain Musical.,"Given the previous statements, is Caltanissetta a PopulatedPlace?",No,Caltanissetta is not a PopulatedPlace.,False
1460,Campobasso leaderName Roberto Gravina.,leaderName has domain Referee.,"Given the previous statements, is Campobasso a PopulatedPlace?",No,Campobasso is not a PopulatedPlace.,False
1461,Camposano leaderName Francesco Barbato.,leaderName has domain Single.,"Given the previous statements, is Camposano a PopulatedPlace?",No,Camposano is not a PopulatedPlace.,False
1462,Cadolzburg leaderParty Christlich-Soziale Union in Bayern.,leaderParty has domain Memorial.,"Given the previous statements, is Cadolzburg a PopulatedPlace?",No,Cadolzburg is not a PopulatedPlace.,False
1463,Cagliari leaderParty Brothers of Italy.,leaderParty has domain Protein.,"Given the previous statements, is Cagliari a PopulatedPlace?",No,Cagliari is not a PopulatedPlace.,False
1464,Camaiore leaderParty Democratic Party.,leaderParty has domain MusicDirector.,"Given the previous statements, is Camaiore a PopulatedPlace?",No,Camaiore is not a PopulatedPlace.,False
1465,Pully lowestPlace Lake Geneva.,lowestPlace has domain StormSurge.,"Given the previous statements, is Pully a Place?",No,Pully is not a Place.,False
1466,"Root, Switzerland lowestPlace Reuss.",lowestPlace has domain Agent.,"Given the previous statements, is Root, Switzerland a Place?",No,"Root, Switzerland is not a Place.",False
1467,Basel lowestPlace Rhine.,lowestPlace has domain TelevisionStation.,"Given the previous statements, is Basel a Place?",No,Basel is not a Place.,False
1468,Campylobacteriosis medicalCause Campylobacter jejuni.,medicalCause has domain Congressman.,"Given the previous statements, is Campylobacteriosis a Disease?",No,Campylobacteriosis is not a Disease.,False
1469,Candidiasis medicalCause Candida.,medicalCause has domain Tower.,"Given the previous statements, is Candidiasis a Disease?",No,Candidiasis is not a Disease.,False
1470,Cardiac tamponade medicalCause Cancer.,medicalCause has domain Bridge.,"Given the previous statements, is Cardiac tamponade a Disease?",No,Cardiac tamponade is not a Disease.,False
1471,Candidiasis medication Clotrimazole.,medication has domain Infrastructure.,"Given the previous statements, is Candidiasis a Disease?",No,Candidiasis is not a Disease.,False
1472,Candidiasis medication Fluconazole.,medication has domain Memorial.,"Given the previous statements, is Candidiasis a Disease?",No,Candidiasis is not a Disease.,False
1473,Candidiasis medication Nystatin.,medication has domain Genre.,"Given the previous statements, is Candidiasis a Disease?",No,Candidiasis is not a Disease.,False
1474,"Carlos Frederico Lecor, Viscount of Laguna militaryRank Marshal.",militaryRank has domain MotorRace.,"Given the previous statements, is Carlos Frederico Lecor, Viscount of Laguna a MilitaryPerson?",No,"Carlos Frederico Lecor, Viscount of Laguna is not a MilitaryPerson.",False
1475,Carlos Holguín Mallarino militaryRank Colonel.,militaryRank has domain Election.,"Given the previous statements, is Carlos Holguín Mallarino a MilitaryPerson?",No,Carlos Holguín Mallarino is not a MilitaryPerson.,False
1476,Carlos Soublette militaryRank Divisional General.,militaryRank has domain Award.,"Given the previous statements, is Carlos Soublette a MilitaryPerson?",No,Carlos Soublette is not a MilitaryPerson.,False
1477,Progressive rock musicSubgenre Neo-progressive rock.,musicSubgenre has domain Moss.,"Given the previous statements, is Progressive rock a MusicGenre?",No,Progressive rock is not a MusicGenre.,False
1478,Progressive rock musicSubgenre Canterbury scene.,musicSubgenre has domain NetballPlayer.,"Given the previous statements, is Progressive rock a MusicGenre?",No,Progressive rock is not a MusicGenre.,False
1479,Progressive rock musicSubgenre Rock in Opposition.,musicSubgenre has domain Beach.,"Given the previous statements, is Progressive rock a MusicGenre?",No,Progressive rock is not a MusicGenre.,False
1480,Cabbrini Foncette nationalTeam Trinidad and Tobago women's national volleyball team.,nationalTeam has domain VicePresident.,"Given the previous statements, is Cabbrini Foncette an Athlete?",No,Cabbrini Foncette is not an Athlete.,False
1481,Camil Domínguez nationalTeam Dominican Republic  women's national volleyball team.,nationalTeam has domain BrownDwarf.,"Given the previous statements, is Camil Domínguez an Athlete?",No,Camil Domínguez is not an Athlete.,False
1482,Camila Brait nationalTeam Brazil women's national volleyball team.,nationalTeam has domain NationalFootballLeagueSeason.,"Given the previous statements, is Camila Brait an Athlete?",No,Camila Brait is not an Athlete.,False
1483,Cabbio neighboringMunicipality Caneggio.,neighboringMunicipality has domain Engineer.,"Given the previous statements, is Cabbio a PopulatedPlace?",No,Cabbio is not a PopulatedPlace.,False
1484,"Cabbio neighboringMunicipality Castel San Pietro, Switzerland.",neighboringMunicipality has domain Tower.,"Given the previous statements, is Cabbio a PopulatedPlace?",No,Cabbio is not a PopulatedPlace.,False
1485,Cabbio neighboringMunicipality Schignano.,neighboringMunicipality has domain MovieDirector.,"Given the previous statements, is Cabbio a PopulatedPlace?",No,Cabbio is not a PopulatedPlace.,False
1486,Cadillac High Technology engine oilSystem Wet sump.,oilSystem has domain CricketTeam.,"Given the previous statements, is Cadillac High Technology engine an AutomobileEngine?",No,Cadillac High Technology engine is not an AutomobileEngine.,False
1487,Caparo T1 engine oilSystem Dry sump.,oilSystem has domain RadioProgram.,"Given the previous statements, is Caparo T1 engine an AutomobileEngine?",No,Caparo T1 engine is not an AutomobileEngine.,False
1488,Powertec RPA oilSystem Dry sump.,oilSystem has domain TelevisionShow.,"Given the previous statements, is Powertec RPA an AutomobileEngine?",No,Powertec RPA is not an AutomobileEngine.,False
1489,Cabonga Reservoir outflow Gens de Terre River.,outflow has domain HistoricalAreaOfAuthority.,"Given the previous statements, is Cabonga Reservoir a BodyOfWater?",No,Cabonga Reservoir is not a BodyOfWater.,False
1490,Cabonga Reservoir outflow Ottawa River.,outflow has domain Comedian.,"Given the previous statements, is Cabonga Reservoir a BodyOfWater?",No,Cabonga Reservoir is not a BodyOfWater.,False
1491,Caburgua Lake outflow Ojos del Caburgua.,outflow has domain CyclingTeam.,"Given the previous statements, is Caburgua Lake a BodyOfWater?",No,Caburgua Lake is not a BodyOfWater.,False
1492,Cale Fleury prospectLeague American Hockey League.,prospectLeague has domain ScreenWriter.,"Given the previous statements, is Cale Fleury an IceHockeyPlayer?",No,Cale Fleury is not an IceHockeyPlayer.,False
1493,Cale Morris prospectLeague ECHL.,prospectLeague has domain Cheese.,"Given the previous statements, is Cale Morris an IceHockeyPlayer?",No,Cale Morris is not an IceHockeyPlayer.,False
1494,Calen Addison prospectLeague American Hockey League.,prospectLeague has domain Province.,"Given the previous statements, is Calen Addison an IceHockeyPlayer?",No,Calen Addison is not an IceHockeyPlayer.,False
1495,Calle Clang prospectTeam Rögle BK.,prospectTeam has domain MotorcycleRider.,"Given the previous statements, is Calle Clang an IceHockeyPlayer?",No,Calle Clang is not an IceHockeyPlayer.,False
1496,Calle Själin prospectTeam Charlotte Checkers.,prospectTeam has domain Curler.,"Given the previous statements, is Calle Själin an IceHockeyPlayer?",No,Calle Själin is not an IceHockeyPlayer.,False
1497,Calvin Pickard prospectTeam Bakersfield Condors.,prospectTeam has domain BullFighter.,"Given the previous statements, is Calvin Pickard an IceHockeyPlayer?",No,Calvin Pickard is not an IceHockeyPlayer.,False
1498,Princeton University provost Deborah Prentice.,provost has domain LacrossePlayer.,"Given the previous statements, is Princeton University an University?",No,Princeton University is not an University.,False
1499,Sciences Po provost Sergei Guriev.,provost has domain SportsTeam.,"Given the previous statements, is Sciences Po an University?",No,Sciences Po is not an University.,False
1500,Baylor College of Medicine provost Alicia D. Monroe.,provost has domain FilmFestival.,"Given the previous statements, is Baylor College of Medicine an University?",No,Baylor College of Medicine is not an University.,False
1501,Captain Elechi Amadi Polytechnic rector Samuel B. Kalagbor.,rector has domain CelestialBody.,"Given the previous statements, is Captain Elechi Amadi Polytechnic an EducationalInstitution?",No,Captain Elechi Amadi Polytechnic is not an EducationalInstitution.,False
1502,Başkent University rector Kenan Araz.,rector has domain Sound.,"Given the previous statements, is Başkent University an EducationalInstitution?",No,Başkent University is not an EducationalInstitution.,False
1503,Pryazovskyi State Technical University rector Vyacheslav Voloshyn.,rector has domain Country.,"Given the previous statements, is Pryazovskyi State Technical University an EducationalInstitution?",No,Pryazovskyi State Technical University is not an EducationalInstitution.,False
1504,Cajun rocketFunction Sounding rocket.,rocketFunction has domain CyclingCompetition.,"Given the previous statements, is Cajun a Rocket?",No,Cajun is not a Rocket.,False
1505,Capricornio rocketFunction Launch vehicle.,rocketFunction has domain Aristocrat.,"Given the previous statements, is Capricornio a Rocket?",No,Capricornio is not a Rocket.,False
1506,Proton-K rocketFunction Heavy-lift launch vehicle.,rocketFunction has domain Sculptor.,"Given the previous statements, is Proton-K a Rocket?",No,Proton-K is not a Rocket.,False
1507,Cabot Education Centre schoolBoard Cape Breton - Victoria Regional School Board.,schoolBoard has domain Reference.,"Given the previous statements, is Cabot Education Centre a School?",No,Cabot Education Centre is not a School.,False
1508,Caddo Magnet High School schoolBoard Caddo Public Schools.,schoolBoard has domain Priest.,"Given the previous statements, is Caddo Magnet High School a School?",No,Caddo Magnet High School is not a School.,False
