ID,triple1,triple2,question,answer,inferred triple,label
1018,"Carver County, Minnesota congressionalDistrict Minnesota's 3rd congressional district.",congressionalDistrict has domain Hormone.,"Given the previous statements, is Carver County, Minnesota an AdministrativeRegion?",No,"Carver County, Minnesota is not an AdministrativeRegion.",False
1019,"Carver County, Minnesota congressionalDistrict Minnesota's 6th congressional district.",congressionalDistrict has domain HotSpring.,"Given the previous statements, is Carver County, Minnesota an AdministrativeRegion?",No,"Carver County, Minnesota is not an AdministrativeRegion.",False
1020,Cadillac AOC growingGrape Muscadelle.,growingGrape has domain CyclingTeam.,"Given the previous statements, is Cadillac AOC a WineRegion?",No,Cadillac AOC is not a WineRegion.,False
1021,Cadillac AOC growingGrape Sauvignon blanc.,growingGrape has domain Region.,"Given the previous statements, is Cadillac AOC a WineRegion?",No,Cadillac AOC is not a WineRegion.,False
1022,Cadillac AOC growingGrape Sauvignon gris.,growingGrape has domain Work.,"Given the previous statements, is Cadillac AOC a WineRegion?",No,Cadillac AOC is not a WineRegion.,False
1023,Quakenbrück jointCommunity Artland.,jointCommunity has domain Cycad.,"Given the previous statements, is Quakenbrück a Settlement?",No,Quakenbrück is not a Settlement.,False
1024,Quendorf jointCommunity Schüttorf.,jointCommunity has domain SportsTeam.,"Given the previous statements, is Quendorf a Settlement?",No,Quendorf is not a Settlement.,False
1025,Quernheim jointCommunity Altes Amt Lemförde.,jointCommunity has domain Chancellor.,"Given the previous statements, is Quernheim a Settlement?",No,Quernheim is not a Settlement.,False
1026,"Castletown, Isle of Man parish Malew.",parish has domain SerialKiller.,"Given the previous statements, is Castletown, Isle of Man a PopulatedPlace?",No,"Castletown, Isle of Man is not a PopulatedPlace.",False
1027,Ronague parish Arbory.,parish has domain InlineHockeyLeague.,"Given the previous statements, is Ronague a PopulatedPlace?",No,Ronague is not a PopulatedPlace.,False
1028,Braaid parish Marown.,parish has domain ArtificialSatellite.,"Given the previous statements, is Braaid a PopulatedPlace?",No,Braaid is not a PopulatedPlace.,False
1029,Canarian People's Union spokesperson Fernando Sagaseta.,spokesperson has domain Area.,"Given the previous statements, is Canarian People's Union a PoliticalParty?",No,Canarian People's Union is not a PoliticalParty.,False
1030,Catalunya Sí que es Pot spokesperson Lluís Rabell.,spokesperson has domain Magazine.,"Given the previous statements, is Catalunya Sí que es Pot a PoliticalParty?",No,Catalunya Sí que es Pot is not a PoliticalParty.,False
1031,Procés Constituent spokesperson Arcadi Oliveres.,spokesperson has domain RollerCoaster.,"Given the previous statements, is Procés Constituent a PoliticalParty?",No,Procés Constituent is not a PoliticalParty.,False
1032,Cairn na Burgh Beag unitaryAuthority Argyll and Bute.,unitaryAuthority has domain WomensTennisAssociationTournament.,"Given the previous statements, is Cairn na Burgh Beag a PopulatedPlace?",No,Cairn na Burgh Beag is not a PopulatedPlace.,False
1033,Cairn na Burgh Mòr unitaryAuthority Argyll and Bute.,unitaryAuthority has domain CelestialBody.,"Given the previous statements, is Cairn na Burgh Mòr a PopulatedPlace?",No,Cairn na Burgh Mòr is not a PopulatedPlace.,False
1034,Calbha Beag unitaryAuthority Highland.,unitaryAuthority has domain MountainRange.,"Given the previous statements, is Calbha Beag a PopulatedPlace?",No,Calbha Beag is not a PopulatedPlace.,False
1035,Capital Area Transportation Authority vehiclesInFleet Tourist trolley.,vehiclesInFleet has domain InternationalOrganisation.,"Given the previous statements, is Capital Area Transportation Authority a PublicTransitSystem?",No,Capital Area Transportation Authority is not a PublicTransitSystem.,False
1036,BeST Transit vehiclesInFleet Dodge Caravan.,vehiclesInFleet has domain Archive.,"Given the previous statements, is BeST Transit a PublicTransitSystem?",No,BeST Transit is not a PublicTransitSystem.,False
1037,Preston park and ride vehiclesInFleet Optare Solo.,vehiclesInFleet has domain CanadianFootballLeague.,"Given the previous statements, is Preston park and ride a PublicTransitSystem?",No,Preston park and ride is not a PublicTransitSystem.,False
1038,Puget Sound AVA wineProduced Dessert wine.,wineProduced has domain Covid19.,"Given the previous statements, is Puget Sound AVA a WineRegion?",No,Puget Sound AVA is not a WineRegion.,False
1039,Puget Sound AVA wineProduced Sparkling wine.,wineProduced has domain Temple.,"Given the previous statements, is Puget Sound AVA a WineRegion?",No,Puget Sound AVA is not a WineRegion.,False
1040,Puget Sound AVA wineProduced Varietal.,wineProduced has domain Manhua.,"Given the previous statements, is Puget Sound AVA a WineRegion?",No,Puget Sound AVA is not a WineRegion.,False
1041,Cercle Brugge K.S.V. clubsRecordGoalscorer Marcel Pertry.,clubsRecordGoalscorer has domain Reign.,"Given the previous statements, is Cercle Brugge K.S.V. a SoccerClub?",No,Cercle Brugge K.S.V. is not a SoccerClub.,False
1042,Al-Baqa'a SC clubsRecordGoalscorer Mohammad Abdel-Haleem.,clubsRecordGoalscorer has domain GivenName.,"Given the previous statements, is Al-Baqa'a SC a SoccerClub?",No,Al-Baqa'a SC is not a SoccerClub.,False
1043,Keila JK clubsRecordGoalscorer Timo Pikpoom.,clubsRecordGoalscorer has domain GreenAlga.,"Given the previous statements, is Keila JK a SoccerClub?",No,Keila JK is not a SoccerClub.,False
1044,Carlos Pace firstWin 1975 Brazilian Grand Prix.,firstWin has domain Valley.,"Given the previous statements, is Carlos Pace a FormulaOneRacer?",No,Carlos Pace is not a FormulaOneRacer.,False
1045,Carlos Sainz Jr. firstWin 2022 British Grand Prix.,firstWin has domain WineRegion.,"Given the previous statements, is Carlos Sainz Jr. a FormulaOneRacer?",No,Carlos Sainz Jr. is not a FormulaOneRacer.,False
1046,Rodger Ward firstWin 1959 Indianapolis 500.,firstWin has domain Community.,"Given the previous statements, is Rodger Ward a FormulaOneRacer?",No,Rodger Ward is not a FormulaOneRacer.,False
1047,Cape Town Cycle Tour firstWinner Lawrence Whittaker.,firstWinner has domain GolfPlayer.,"Given the previous statements, is Cape Town Cycle Tour a Race?",No,Cape Town Cycle Tour is not a Race.,False
1048,Presbyterian Hospital Invitational Criterium firstWinner Ivan Dominguez.,firstWinner has domain Sport.,"Given the previous statements, is Presbyterian Hospital Invitational Criterium a Race?",No,Presbyterian Hospital Invitational Criterium is not a Race.,False
1049,Presbyterian Hospital Invitational Criterium firstWinner Ina Tuentenburg.,firstWinner has domain TrainCarriage.,"Given the previous statements, is Presbyterian Hospital Invitational Criterium a Race?",No,Presbyterian Hospital Invitational Criterium is not a Race.,False
1050,Rousay largestSettlement Brinian.,largestSettlement has domain Skos.,"Given the previous statements, is Rousay a PopulatedPlace?",No,Rousay is not a PopulatedPlace.,False
1051,"Sanday, Orkney largestSettlement Kettletoft.",largestSettlement has domain Brewery.,"Given the previous statements, is Sanday, Orkney a PopulatedPlace?",No,"Sanday, Orkney is not a PopulatedPlace.",False
1052,Barra largestSettlement Castlebay.,largestSettlement has domain RugbyPlayer.,"Given the previous statements, is Barra a PopulatedPlace?",No,Barra is not a PopulatedPlace.,False
1053,Carlos Pace lastWin 1975 Brazilian Grand Prix.,lastWin has domain PoliticalFunction.,"Given the previous statements, is Carlos Pace a FormulaOneRacer?",No,Carlos Pace is not a FormulaOneRacer.,False
1054,Carlos Sainz Jr. lastWin 2022 British Grand Prix.,lastWin has domain CityDistrict.,"Given the previous statements, is Carlos Sainz Jr. a FormulaOneRacer?",No,Carlos Sainz Jr. is not a FormulaOneRacer.,False
1055,Rodger Ward lastWin 1959 Indianapolis 500.,lastWin has domain SnookerPlayer.,"Given the previous statements, is Rodger Ward a FormulaOneRacer?",No,Rodger Ward is not a FormulaOneRacer.,False
1056,Calgary Sun managingEditor Martin Hudson.,managingEditor has domain SoccerClubSeason.,"Given the previous statements, is Calgary Sun a Newspaper?",No,Calgary Sun is not a Newspaper.,False
1057,Umanità Nova managingEditor Giorgio Sacchetti.,managingEditor has domain UndergroundJournal.,"Given the previous statements, is Umanità Nova a Newspaper?",No,Umanità Nova is not a Newspaper.,False
1058,Uthayan managingEditor E. Saravanapavan.,managingEditor has domain MusicComposer.,"Given the previous statements, is Uthayan a Newspaper?",No,Uthayan is not a Newspaper.,False
1059,Cape Town Cycle Tour mostWins Willie Engelbrecht.,mostWins has domain SoapCharacter.,"Given the previous statements, is Cape Town Cycle Tour a Race?",No,Cape Town Cycle Tour is not a Race.,False
1060,Presbyterian Hospital Invitational Criterium mostWins Tina Pic.,mostWins has domain VideogamesLeague.,"Given the previous statements, is Presbyterian Hospital Invitational Criterium a Race?",No,Presbyterian Hospital Invitational Criterium is not a Race.,False
1061,Belarusian National Road Race Championships mostWins Yauhen Sobal.,mostWins has domain Fort.,"Given the previous statements, is Belarusian National Road Race Championships a Race?",No,Belarusian National Road Race Championships is not a Race.,False
1062,Cape Town Cycle Tour recentWinner Marc Pritzen.,recentWinner has domain SoccerClub.,"Given the previous statements, is Cape Town Cycle Tour a Race?",No,Cape Town Cycle Tour is not a Race.,False
1063,Presbyterian Hospital Invitational Criterium recentWinner Theresa Cliff-Ryan.,recentWinner has domain BobsleighAthlete.,"Given the previous statements, is Presbyterian Hospital Invitational Criterium a Race?",No,Presbyterian Hospital Invitational Criterium is not a Race.,False
1064,Presbyterian Hospital Invitational Criterium recentWinner Jake Keough.,recentWinner has domain Journalist.,"Given the previous statements, is Presbyterian Hospital Invitational Criterium a Race?",No,Presbyterian Hospital Invitational Criterium is not a Race.,False
1065,"Saskatchewan Highway 1 ruralMunicipality Pense No. 160, Saskatchewan.",ruralMunicipality has domain Bay.,"Given the previous statements, is Saskatchewan Highway 1 a Road?",No,Saskatchewan Highway 1 is not a Road.,False
1066,"Saskatchewan Highway 1 ruralMunicipality Silverwood No. 123, Saskatchewan.",ruralMunicipality has domain Bird.,"Given the previous statements, is Saskatchewan Highway 1 a Road?",No,Saskatchewan Highway 1 is not a Road.,False
1067,"Saskatchewan Highway 1 ruralMunicipality Swift Current No. 137, Saskatchewan.",ruralMunicipality has domain CricketTeam.,"Given the previous statements, is Saskatchewan Highway 1 a Road?",No,Saskatchewan Highway 1 is not a Road.,False
1068,Quebec Route 335 subsequentInfrastructure Quebec Route 337.,subsequentInfrastructure has domain ElectionDiagram.,"Given the previous statements, is Quebec Route 335 an Infrastructure?",No,Quebec Route 335 is not an Infrastructure.,False
1069,Saskatchewan Highway 155 subsequentInfrastructure Saskatchewan Highway 165.,subsequentInfrastructure has domain Architect.,"Given the previous statements, is Saskatchewan Highway 155 an Infrastructure?",No,Saskatchewan Highway 155 is not an Infrastructure.,False
1070,Saskatchewan Highway 2 subsequentInfrastructure Saskatchewan Highway 3.,subsequentInfrastructure has domain Canton.,"Given the previous statements, is Saskatchewan Highway 2 an Infrastructure?",No,Saskatchewan Highway 2 is not an Infrastructure.,False
1071,Savar Cantonment Public School and College superintendent Bangladesh Army.,superintendent has domain Territory.,"Given the previous statements, is Savar Cantonment Public School and College an Organisation?",No,Savar Cantonment Public School and College is not an Organisation.,False
1072,Brashier Middle College Charter High School superintendent .,superintendent has domain RouteStop.,"Given the previous statements, is Brashier Middle College Charter High School an Organisation?",No,Brashier Middle College Charter High School is not an Organisation.,False
1073,Bridgeprep Academy of Arts and Minds superintendent Alberto M. Carvalho.,superintendent has domain Cave.,"Given the previous statements, is Bridgeprep Academy of Arts and Minds an Organisation?",No,Bridgeprep Academy of Arts and Minds is not an Organisation.,False
1074,Cal Sandbeck whaDraftTeam Calgary Cowboys.,whaDraftTeam has domain Airline.,"Given the previous statements, is Cal Sandbeck an IceHockeyPlayer?",No,Cal Sandbeck is not an IceHockeyPlayer.,False
1075,Cam Botting whaDraftTeam Edmonton Oilers.,whaDraftTeam has domain CelestialBody.,"Given the previous statements, is Cam Botting an IceHockeyPlayer?",No,Cam Botting is not an IceHockeyPlayer.,False
1076,Cam Connor whaDraftTeam Phoenix Roadrunners.,whaDraftTeam has domain Street.,"Given the previous statements, is Cam Connor an IceHockeyPlayer?",No,Cam Connor is not an IceHockeyPlayer.,False
1077,"Ethyl iodoacetate inchi h2-3H2,1H3.",inchi has domain Dike.,"Given the previous statements, is Ethyl iodoacetate a ChemicalCompound?",No,Ethyl iodoacetate is not a ChemicalCompound.,False
1078,"Caballero, Coclé areaLand 4.15e+07.",areaLand has domain Factory.,"Given the previous statements, is Caballero, Coclé a Place?",No,"Caballero, Coclé is not a Place.",False
1079,"Caballo, New Mexico areaLand 2.53819e+06.",areaLand has domain RecordOffice.,"Given the previous statements, is Caballo, New Mexico a Place?",No,"Caballo, New Mexico is not a Place.",False
1080,"Caballo, New Mexico areaLand 2.54e+06.",areaLand has domain Skos.,"Given the previous statements, is Caballo, New Mexico a Place?",No,"Caballo, New Mexico is not a Place.",False
1081,Callistus Caravario beatifiedDate 1983-05-15.,beatifiedDate has domain Competition.,"Given the previous statements, is Callistus Caravario a Saint?",No,Callistus Caravario is not a Saint.,False
1082,Camilla Battista da Varano beatifiedDate 1843-04-07.,beatifiedDate has domain MotorRace.,"Given the previous statements, is Camilla Battista da Varano a Saint?",No,Camilla Battista da Varano is not a Saint.,False
1083,Candelaria of San José beatifiedDate 2008-04-27.,beatifiedDate has domain Sculpture.,"Given the previous statements, is Candelaria of San José a Saint?",No,Candelaria of San José is not a Saint.,False
1084,Caffeine bioavailability 99.0.,bioavailability has domain Spacecraft.,"Given the previous statements, is Caffeine a Drug?",No,Caffeine is not a Drug.,False
1085,Calcipotriol bioavailability 5.0.,bioavailability has domain Sculptor.,"Given the previous statements, is Calcipotriol a Drug?",No,Calcipotriol is not a Drug.,False
1086,Camazepam bioavailability 90.0.,bioavailability has domain Pope.,"Given the previous statements, is Camazepam a Drug?",No,Camazepam is not a Drug.,False
1087,Roccy FM broadcastTranslator 104.1 MHzTemora.,broadcastTranslator has domain Valley.,"Given the previous statements, is Roccy FM a Broadcaster?",No,Roccy FM is not a Broadcaster.,False
1088,Roccy FM broadcastTranslator 107.7 MHzCootamundra.,broadcastTranslator has domain Mammal.,"Given the previous statements, is Roccy FM a Broadcaster?",No,Roccy FM is not a Broadcaster.,False
1089,Roccy FM broadcastTranslator 99.5 MHzCowra.,broadcastTranslator has domain SportsLeague.,"Given the previous statements, is Roccy FM a Broadcaster?",No,Roccy FM is not a Broadcaster.,False
1090,Caledonian cylinderCount 2.,cylinderCount has domain VideogamesLeague.,"Given the previous statements, is Caledonian a Locomotive?",No,Caledonian is not a Locomotive.,False
1091,Canadian National 7470 cylinderCount 2.,cylinderCount has domain Philosopher.,"Given the previous statements, is Canadian National 7470 a Locomotive?",No,Canadian National 7470 is not a Locomotive.,False
1092,Progress Rail PR30C cylinderCount 16.,cylinderCount has domain Place.,"Given the previous statements, is Progress Rail PR30C a Locomotive?",No,Progress Rail PR30C is not a Locomotive.,False
1093,Cafe La Haye dressCode Casual.,dressCode has domain MouseGene.,"Given the previous statements, is Cafe La Haye a Restaurant?",No,Cafe La Haye is not a Restaurant.,False
1094,Cafe Mondegar dressCode None.,dressCode has domain ChristianDoctrine.,"Given the previous statements, is Cafe Mondegar a Restaurant?",No,Cafe Mondegar is not a Restaurant.,False
1095,Café du Monde dressCode Casual.,dressCode has domain NationalSoccerClub.,"Given the previous statements, is Café du Monde a Restaurant?",No,Café du Monde is not a Restaurant.,False
1096,Cab Calloway School of the Arts facultySize 48.,facultySize has domain Taxon.,"Given the previous statements, is Cab Calloway School of the Arts an EducationalInstitution?",No,Cab Calloway School of the Arts is not an EducationalInstitution.,False
1097,Cabot High School facultySize 125.,facultySize has domain Vein.,"Given the previous statements, is Cabot High School an EducationalInstitution?",No,Cabot High School is not an EducationalInstitution.,False
1098,Cabramatta High School facultySize 122.,facultySize has domain Planet.,"Given the previous statements, is Cabramatta High School an EducationalInstitution?",No,Cabramatta High School is not an EducationalInstitution.,False
1099,American Academy of Political and Social Science finalPublicationYear 1890.,finalPublicationYear has domain Grape.,"Given the previous statements, is American Academy of Political and Social Science a PeriodicalLiterature?",No,American Academy of Political and Social Science is not a PeriodicalLiterature.,False
1100,American Bankruptcy Law Journal finalPublicationYear 1993.,finalPublicationYear has domain RailwayStation.,"Given the previous statements, is American Bankruptcy Law Journal a PeriodicalLiterature?",No,American Bankruptcy Law Journal is not a PeriodicalLiterature.,False
1101,American Ecclesiastical Review finalPublicationYear 1975.,finalPublicationYear has domain SystemOfLaw.,"Given the previous statements, is American Ecclesiastical Review a PeriodicalLiterature?",No,American Ecclesiastical Review is not a PeriodicalLiterature.,False
1102,Catecholaminergic polymorphic ventricular tachycardia geneReviewsId NBK1289.,geneReviewsId has domain Model.,"Given the previous statements, is Catecholaminergic polymorphic ventricular tachycardia a Disease?",No,Catecholaminergic polymorphic ventricular tachycardia is not a Disease.,False
1103,Beckwith–Wiedemann syndrome geneReviewsId NBK1394.,geneReviewsId has domain Standard.,"Given the previous statements, is Beckwith–Wiedemann syndrome a Disease?",No,Beckwith–Wiedemann syndrome is not a Disease.,False
1104,Benign hereditary chorea geneReviewsId NBK185066.,geneReviewsId has domain Vicar.,"Given the previous statements, is Benign hereditary chorea a Disease?",No,Benign hereditary chorea is not a Disease.,False
1105,Beckwith–Wiedemann syndrome geneReviewsName Beckwith–Wiedemann Syndrome.,geneReviewsName has domain VideoGame.,"Given the previous statements, is Beckwith–Wiedemann syndrome a Disease?",No,Beckwith–Wiedemann syndrome is not a Disease.,False
1106,Benign hereditary chorea geneReviewsName NKX2-1-Related Disorders.,geneReviewsName has domain Manga.,"Given the previous statements, is Benign hereditary chorea a Disease?",No,Benign hereditary chorea is not a Disease.,False
1107,Prader–Willi syndrome geneReviewsName Prader-Willi syndrome.,geneReviewsName has domain Desert.,"Given the previous statements, is Prader–Willi syndrome a Disease?",No,Prader–Willi syndrome is not a Disease.,False
1108,Caballococha Airport icaoLocationIdentifier SPBC.,icaoLocationIdentifier has domain TopicalConcept.,"Given the previous statements, is Caballococha Airport an Airport?",No,Caballococha Airport is not an Airport.,False
1109,Cabana Airstrip icaoLocationIdentifier SMCB.,icaoLocationIdentifier has domain Photographer.,"Given the previous statements, is Cabana Airstrip an Airport?",No,Cabana Airstrip is not an Airport.,False
1110,Cabezas Airport icaoLocationIdentifier SLCE.,icaoLocationIdentifier has domain AnatomicalStructure.,"Given the previous statements, is Cabezas Airport an Airport?",No,Cabezas Airport is not an Airport.,False
1111,Canadian Journal of Earth Sciences impactFactor 1.369.,impactFactor has domain RugbyLeague.,"Given the previous statements, is Canadian Journal of Earth Sciences an AcademicJournal?",No,Canadian Journal of Earth Sciences is not an AcademicJournal.,False
1112,Canadian Journal of Fisheries and Aquatic Sciences impactFactor 2.595.,impactFactor has domain Anime.,"Given the previous statements, is Canadian Journal of Fisheries and Aquatic Sciences an AcademicJournal?",No,Canadian Journal of Fisheries and Aquatic Sciences is not an AcademicJournal.,False
1113,Cannabis and Cannabinoid Research impactFactor 5.764.,impactFactor has domain BaseballTeam.,"Given the previous statements, is Cannabis and Cannabinoid Research an AcademicJournal?",No,Cannabis and Cannabinoid Research is not an AcademicJournal.,False
1114,Canadian Journal of Earth Sciences impactFactorAsOf 2020.,impactFactorAsOf has domain NetballPlayer.,"Given the previous statements, is Canadian Journal of Earth Sciences an AcademicJournal?",No,Canadian Journal of Earth Sciences is not an AcademicJournal.,False
1115,Canadian Journal of Fisheries and Aquatic Sciences impactFactorAsOf 2020.,impactFactorAsOf has domain MilitaryService.,"Given the previous statements, is Canadian Journal of Fisheries and Aquatic Sciences an AcademicJournal?",No,Canadian Journal of Fisheries and Aquatic Sciences is not an AcademicJournal.,False
1116,American Academy of Political and Social Science impactFactorAsOf 2017.,impactFactorAsOf has domain Protein.,"Given the previous statements, is American Academy of Political and Social Science an AcademicJournal?",No,American Academy of Political and Social Science is not an AcademicJournal.,False
1117,Rotuaari lengthReference .,lengthReference has domain TradeUnion.,"Given the previous statements, is Rotuaari a RouteOfTransportation?",No,Rotuaari is not a RouteOfTransportation.,False
1118,Connaught Square lengthReference .,lengthReference has domain ChemicalElement.,"Given the previous statements, is Connaught Square a RouteOfTransportation?",No,Connaught Square is not a RouteOfTransportation.,False
1119,Garbary Street lengthReference Google maps.,lengthReference has domain SiteOfSpecialScientificInterest.,"Given the previous statements, is Garbary Street a RouteOfTransportation?",No,Garbary Street is not a RouteOfTransportation.,False
1120,Caboolture railway line lineLength 49570.0.,lineLength has domain CricketGround.,"Given the previous statements, is Caboolture railway line a RouteOfTransportation?",No,Caboolture railway line is not a RouteOfTransportation.,False
1121,Cadia Mine railway line lineLength 18507.5.,lineLength has domain Governor.,"Given the previous statements, is Cadia Mine railway line a RouteOfTransportation?",No,Cadia Mine railway line is not a RouteOfTransportation.,False
1122,Cairngorm Mountain Railway lineLength 1970.0.,lineLength has domain Planet.,"Given the previous statements, is Cairngorm Mountain Railway a RouteOfTransportation?",No,Cairngorm Mountain Railway is not a RouteOfTransportation.,False
1123,Cannabinoid receptor locusSupplementaryData -q15.,locusSupplementaryData has domain Gnetophytes.,"Given the previous statements, is Cannabinoid receptor a Protein?",No,Cannabinoid receptor is not a Protein.,False
1124,Amelogenin locusSupplementaryData -p22.1.,locusSupplementaryData has domain Surfer.,"Given the previous statements, is Amelogenin a Protein?",No,Amelogenin is not a Protein.,False
1125,Presenilin locusSupplementaryData -q42.,locusSupplementaryData has domain Monument.,"Given the previous statements, is Presenilin a Protein?",No,Presenilin is not a Protein.,False
1126,Cabot Strait maximumDepth 550.0.,maximumDepth has domain Artwork.,"Given the previous statements, is Cabot Strait a Place?",No,Cabot Strait is not a Place.,False
1127,Caddy Lake maximumDepth 5.7.,maximumDepth has domain HockeyTeam.,"Given the previous statements, is Caddy Lake a Place?",No,Caddy Lake is not a Place.,False
1128,Cage Lake maximumDepth 7.62.,maximumDepth has domain TelevisionShow.,"Given the previous statements, is Cage Lake a Place?",No,Cage Lake is not a Place.,False
1129,"Cadwalader, Wickersham & Taft numberOfLawyers 400.",numberOfLawyers has domain StormSurge.,"Given the previous statements, is Cadwalader, Wickersham & Taft a LawFirm?",No,"Cadwalader, Wickersham & Taft is not a LawFirm.",False
1130,Cahill Gordon & Reindel numberOfLawyers 350.,numberOfLawyers has domain AthleticsPlayer.,"Given the previous statements, is Cahill Gordon & Reindel a LawFirm?",No,Cahill Gordon & Reindel is not a LawFirm.,False
1131,Carter Ledyard & Milburn numberOfLawyers 114.,numberOfLawyers has domain AnimangaCharacter.,"Given the previous statements, is Carter Ledyard & Milburn a LawFirm?",No,Carter Ledyard & Milburn is not a LawFirm.,False
1132,Cablebús numberOfStations 13.,numberOfStations has domain Taxon.,"Given the previous statements, is Cablebús a RouteOfTransportation?",No,Cablebús is not a RouteOfTransportation.,False
1133,Cabletren Bolivariano numberOfStations 5.,numberOfStations has domain MusicalWork.,"Given the previous statements, is Cabletren Bolivariano a RouteOfTransportation?",No,Cabletren Bolivariano is not a RouteOfTransportation.,False
1134,Caboolture railway line numberOfStations 13.,numberOfStations has domain Arachnid.,"Given the previous statements, is Caboolture railway line a RouteOfTransportation?",No,Caboolture railway line is not a RouteOfTransportation.,False
