ID,triple1,triple2,question,answer,inferred triple,label
505,Capricornio rocketFunction Launch vehicle.,rocketFunction has domain Rocket.,"Given the previous statements, is Capricornio a Rocket?",Yes,Capricornio is a Rocket.,True
506,Proton-K rocketFunction Heavy-lift launch vehicle.,rocketFunction has domain Rocket.,"Given the previous statements, is Proton-K a Rocket?",Yes,Proton-K is a Rocket.,True
507,Cabot Education Centre schoolBoard Cape Breton - Victoria Regional School Board.,schoolBoard has domain School.,"Given the previous statements, is Cabot Education Centre a School?",Yes,Cabot Education Centre is a School.,True
508,Caddo Magnet High School schoolBoard Caddo Public Schools.,schoolBoard has domain School.,"Given the previous statements, is Caddo Magnet High School a School?",Yes,Caddo Magnet High School is a School.,True
509,Cairine Wilson Secondary School schoolBoard Ottawa Carleton District School Board.,schoolBoard has domain School.,"Given the previous statements, is Cairine Wilson Secondary School a School?",Yes,Cairine Wilson Secondary School is a School.,True
510,Robin Boyd significantDesign Modern architecture.,significantDesign has domain Architect.,"Given the previous statements, is Robin Boyd an Architect?",Yes,Robin Boyd is an Architect.,True
511,Rogier van der Heide significantDesign Abu Dhabi.,significantDesign has domain Architect.,"Given the previous statements, is Rogier van der Heide an Architect?",Yes,Rogier van der Heide is an Architect.,True
512,Rogier van der Heide significantDesign Seoul.,significantDesign has domain Architect.,"Given the previous statements, is Rogier van der Heide an Architect?",Yes,Rogier van der Heide is an Architect.,True
513,Calvert Vaux significantProject Prospect Park.,significantProject has domain Person.,"Given the previous statements, is Calvert Vaux a Person?",Yes,Calvert Vaux is a Person.,True
514,"Calvert Vaux significantProject Rockwood Park, Saint John.",significantProject has domain Person.,"Given the previous statements, is Calvert Vaux a Person?",Yes,Calvert Vaux is a Person.,True
515,Calvert Vaux significantProject Samuel J. Tilden House.,significantProject has domain Person.,"Given the previous statements, is Calvert Vaux a Person?",Yes,Calvert Vaux is a Person.,True
516,Cao Xinlong sportCountry China.,sportCountry has domain Athlete.,"Given the previous statements, is Cao Xinlong an Athlete?",Yes,Cao Xinlong is an Athlete.,True
517,Cao Yupeng sportCountry China.,sportCountry has domain Athlete.,"Given the previous statements, is Cao Yupeng an Athlete?",Yes,Cao Yupeng is an Athlete.,True
518,Robin Hull sportCountry Finland.,sportCountry has domain Athlete.,"Given the previous statements, is Robin Hull an Athlete?",Yes,Robin Hull is an Athlete.,True
519,Campylobacteriosis symptom Fever.,symptom has domain Disease.,"Given the previous statements, is Campylobacteriosis a Disease?",Yes,Campylobacteriosis is a Disease.,True
520,Campylobacteriosis symptom Diarrhea.,symptom has domain Disease.,"Given the previous statements, is Campylobacteriosis a Disease?",Yes,Campylobacteriosis is a Disease.,True
521,Campylobacteriosis symptom Abdominal pain.,symptom has domain Disease.,"Given the previous statements, is Campylobacteriosis a Disease?",Yes,Campylobacteriosis is a Disease.,True
522,Cabeça do Cachorro topLevelDomain .br.,topLevelDomain has domain Country.,"Given the previous statements, is Cabeça do Cachorro a Country?",Yes,Cabeça do Cachorro is a Country.,True
523,Cambodia topLevelDomain .kh.,topLevelDomain has domain Country.,"Given the previous statements, is Cambodia a Country?",Yes,Cambodia is a Country.,True
524,Cameroon topLevelDomain .cm.,topLevelDomain has domain Country.,"Given the previous statements, is Cameroon a Country?",Yes,Cameroon is a Country.,True
525,Cady Noland training Sarah Lawrence College.,training has domain Artist.,"Given the previous statements, is Cady Noland an Artist?",Yes,Cady Noland is an Artist.,True
526,Cai Guo-Qiang training Shanghai Theatre Academy.,training has domain Artist.,"Given the previous statements, is Cai Guo-Qiang an Artist?",Yes,Cai Guo-Qiang is an Artist.,True
527,Cai Jin training Anhui Normal University.,training has domain Artist.,"Given the previous statements, is Cai Jin an Artist?",Yes,Cai Jin is an Artist.,True
528,Campylobacteriosis treatment Supportive care.,treatment has domain Disease.,"Given the previous statements, is Campylobacteriosis a Disease?",Yes,Campylobacteriosis is a Disease.,True
529,Cancer treatment Chemotherapy.,treatment has domain Disease.,"Given the previous statements, is Cancer a Disease?",Yes,Cancer is a Disease.,True
530,Cancer treatment Targeted therapy.,treatment has domain Disease.,"Given the previous statements, is Cancer a Disease?",Yes,Cancer is a Disease.,True
531,Cacabelos twinTown Torano Nuovo.,twinTown has domain Settlement.,"Given the previous statements, is Cacabelos a Settlement?",Yes,Cacabelos is a Settlement.,True
532,Carrouge twinTown Carrouges.,twinTown has domain Settlement.,"Given the previous statements, is Carrouge a Settlement?",Yes,Carrouge is a Settlement.,True
533,Cartaya twinTown Loulé.,twinTown has domain Settlement.,"Given the previous statements, is Cartaya a Settlement?",Yes,Cartaya is a Settlement.,True
534,Cambodian franc usingCountry French Cambodia.,usingCountry has domain Currency.,"Given the previous statements, is Cambodian franc a Currency?",Yes,Cambodian franc is a Currency.,True
535,Cambodian riel usingCountry Cambodia.,usingCountry has domain Currency.,"Given the previous statements, is Cambodian riel a Currency?",Yes,Cambodian riel is a Currency.,True
536,Canadian dollar usingCountry Canada.,usingCountry has domain Currency.,"Given the previous statements, is Canadian dollar a Currency?",Yes,Canadian dollar is a Currency.,True
537,California Republican Party youthWing California College Republicans.,youthWing has domain PoliticalParty.,"Given the previous statements, is California Republican Party a PoliticalParty?",Yes,California Republican Party is a PoliticalParty.,True
538,CasaPound youthWing Students' Block.,youthWing has domain PoliticalParty.,"Given the previous statements, is CasaPound a PoliticalParty?",Yes,CasaPound is a PoliticalParty.,True
539,Castilian Left youthWing Yesca.,youthWing has domain PoliticalParty.,"Given the previous statements, is Castilian Left a PoliticalParty?",Yes,Castilian Left is a PoliticalParty.,True
540,Premawathie Manamperi bodyDiscovered Kataragama.,bodyDiscovered has domain Person.,"Given the previous statements, is Premawathie Manamperi a Person?",Yes,Premawathie Manamperi is a Person.,True
541,"Roy Radin bodyDiscovered Gorman, California.",bodyDiscovered has domain Person.,"Given the previous statements, is Roy Radin a Person?",Yes,Roy Radin is a Person.,True
542,"Enrique Perea Quintanilla bodyDiscovered Juan Aldama, Chihuahua.",bodyDiscovered has domain Person.,"Given the previous statements, is Enrique Perea Quintanilla a Person?",Yes,Enrique Perea Quintanilla is a Person.,True
543,Cambodia's Got Talent showJudge Preap Sovath.,showJudge has domain TelevisionShow.,"Given the previous statements, is Cambodia's Got Talent a TelevisionShow?",Yes,Cambodia's Got Talent is a TelevisionShow.,True
544,Cambodian Idol showJudge Preap Sovath.,showJudge has domain TelevisionShow.,"Given the previous statements, is Cambodian Idol a TelevisionShow?",Yes,Cambodian Idol is a TelevisionShow.,True
545,Cambodian Idol showJudge Aok Sokunkanha.,showJudge has domain TelevisionShow.,"Given the previous statements, is Cambodian Idol a TelevisionShow?",Yes,Cambodian Idol is a TelevisionShow.,True
546,Canoeing at the 2020 Summer Olympics – Women's slalom C-1 bronzeMedalist Andrea Herzog.,bronzeMedalist has domain SportsEvent.,"Given the previous statements, is Canoeing at the 2020 Summer Olympics – Women's slalom C-1 a SportsEvent?",Yes,Canoeing at the 2020 Summer Olympics – Women's slalom C-1 is a SportsEvent.,True
547,Beach volleyball at the 1996 Summer Olympics – Women's tournament bronzeMedalist Kerri Pottharst.,bronzeMedalist has domain SportsEvent.,"Given the previous statements, is Beach volleyball at the 1996 Summer Olympics – Women's tournament a SportsEvent?",Yes,Beach volleyball at the 1996 Summer Olympics – Women's tournament is a SportsEvent.,True
548,Beach volleyball at the 1996 Summer Olympics – Women's tournament bronzeMedalist Natalie Cook.,bronzeMedalist has domain SportsEvent.,"Given the previous statements, is Beach volleyball at the 1996 Summer Olympics – Women's tournament a SportsEvent?",Yes,Beach volleyball at the 1996 Summer Olympics – Women's tournament is a SportsEvent.,True
549,Calgary City Council committeeInLegislature Boards-Commissions-and-Committees.aspx.,committeeInLegislature has domain Legislature.,"Given the previous statements, is Calgary City Council a Legislature?",Yes,Calgary City Council is a Legislature.,True
550,Scottish Parliament committeeInLegislature Culture of Scotland.,committeeInLegislature has domain Legislature.,"Given the previous statements, is Scottish Parliament a Legislature?",Yes,Scottish Parliament is a Legislature.,True
551,Scottish Parliament committeeInLegislature Tourism in Scotland.,committeeInLegislature has domain Legislature.,"Given the previous statements, is Scottish Parliament a Legislature?",Yes,Scottish Parliament is a Legislature.,True
552,Casa del Fundador Gonzalo Suárez Rendón curator Tunja.,curator has domain Museum.,"Given the previous statements, is Casa del Fundador Gonzalo Suárez Rendón a Museum?",Yes,Casa del Fundador Gonzalo Suárez Rendón is a Museum.,True
553,Cascadia Art Museum curator David F. Martin.,curator has domain Museum.,"Given the previous statements, is Cascadia Art Museum a Museum?",Yes,Cascadia Art Museum is a Museum.,True
554,Pre-Columbian Gold Museum curator Central Bank of Costa Rica.,curator has domain Museum.,"Given the previous statements, is Pre-Columbian Gold Museum a Museum?",Yes,Pre-Columbian Gold Museum is a Museum.,True
555,Derrick Jasper formerHighschool Kentucky Wildcats men's basketball.,formerHighschool has domain NationalCollegiateAthleticAssociationAthlete.,"Given the previous statements, is Derrick Jasper a NationalCollegiateAthleticAssociationAthlete?",Yes,Derrick Jasper is a NationalCollegiateAthleticAssociationAthlete.,True
556,Yous Mbao formerHighschool Marquette Golden Eagles men's basketball.,formerHighschool has domain NationalCollegiateAthleticAssociationAthlete.,"Given the previous statements, is Yous Mbao a NationalCollegiateAthleticAssociationAthlete?",Yes,Yous Mbao is a NationalCollegiateAthleticAssociationAthlete.,True
557,Allen Webb formerHighschool Indiana University.,formerHighschool has domain NationalCollegiateAthleticAssociationAthlete.,"Given the previous statements, is Allen Webb a NationalCollegiateAthleticAssociationAthlete?",Yes,Allen Webb is a NationalCollegiateAthleticAssociationAthlete.,True
558,Canoeing at the 2020 Summer Olympics – Women's slalom C-1 goldMedalist Jessica Fox.,goldMedalist has domain SportsEvent.,"Given the previous statements, is Canoeing at the 2020 Summer Olympics – Women's slalom C-1 a SportsEvent?",Yes,Canoeing at the 2020 Summer Olympics – Women's slalom C-1 is a SportsEvent.,True
559,Beach volleyball at the 1996 Summer Olympics – Women's tournament goldMedalist Sandra Pires.,goldMedalist has domain SportsEvent.,"Given the previous statements, is Beach volleyball at the 1996 Summer Olympics – Women's tournament a SportsEvent?",Yes,Beach volleyball at the 1996 Summer Olympics – Women's tournament is a SportsEvent.,True
560,Beach volleyball at the 1996 Summer Olympics – Women's tournament goldMedalist Jackie Silva.,goldMedalist has domain SportsEvent.,"Given the previous statements, is Beach volleyball at the 1996 Summer Olympics – Women's tournament a SportsEvent?",Yes,Beach volleyball at the 1996 Summer Olympics – Women's tournament is a SportsEvent.,True
561,More Joyous jockey Nash Rawiller.,jockey has domain Horse.,"Given the previous statements, is More Joyous a Horse?",Yes,More Joyous is a Horse.,True
562,Bobs Worth jockey Barry Geraghty.,jockey has domain Horse.,"Given the previous statements, is Bobs Worth a Horse?",Yes,Bobs Worth is a Horse.,True
563,All Too Hard jockey Dwayne Dunn.,jockey has domain Horse.,"Given the previous statements, is All Too Hard a Horse?",Yes,All Too Hard is a Horse.,True
564,Canoeing at the 2020 Summer Olympics – Women's slalom C-1 nextEvent Canoeing at the 2024 Summer Olympics – Women's slalom C-1.,nextEvent has domain Event.,"Given the previous statements, is Canoeing at the 2020 Summer Olympics – Women's slalom C-1 an Event?",Yes,Canoeing at the 2020 Summer Olympics – Women's slalom C-1 is an Event.,True
565,Beach handball at the 2018 Summer Youth Olympics nextEvent Beach handball at the 2026 Summer Youth Olympics.,nextEvent has domain Event.,"Given the previous statements, is Beach handball at the 2018 Summer Youth Olympics an Event?",Yes,Beach handball at the 2018 Summer Youth Olympics is an Event.,True
566,Beach volleyball at the 1996 Summer Olympics – Women's tournament nextEvent Beach volleyball at the 2000 Summer Olympics – Women's tournament.,nextEvent has domain Event.,"Given the previous statements, is Beach volleyball at the 1996 Summer Olympics – Women's tournament an Event?",Yes,Beach volleyball at the 1996 Summer Olympics – Women's tournament is an Event.,True
567,Canoeing at the 2020 Summer Olympics – Women's slalom C-1 silverMedalist Mallory Franklin.,silverMedalist has domain SportsEvent.,"Given the previous statements, is Canoeing at the 2020 Summer Olympics – Women's slalom C-1 a SportsEvent?",Yes,Canoeing at the 2020 Summer Olympics – Women's slalom C-1 is a SportsEvent.,True
568,Beach volleyball at the 1996 Summer Olympics – Women's tournament silverMedalist Mônica Rodrigues.,silverMedalist has domain SportsEvent.,"Given the previous statements, is Beach volleyball at the 1996 Summer Olympics – Women's tournament a SportsEvent?",Yes,Beach volleyball at the 1996 Summer Olympics – Women's tournament is a SportsEvent.,True
569,Beach volleyball at the 1996 Summer Olympics – Women's tournament silverMedalist Adriana Samuel.,silverMedalist has domain SportsEvent.,"Given the previous statements, is Beach volleyball at the 1996 Summer Olympics – Women's tournament a SportsEvent?",Yes,Beach volleyball at the 1996 Summer Olympics – Women's tournament is a SportsEvent.,True
570,Corinne Dibnah winsAtLET List of golfers with most Ladies European Tour wins.,winsAtLET has domain GolfPlayer.,"Given the previous statements, is Corinne Dibnah a GolfPlayer?",Yes,Corinne Dibnah is a GolfPlayer.,True
571,Annika Sörenstam winsAtLET List of golfers with most Ladies European Tour wins.,winsAtLET has domain GolfPlayer.,"Given the previous statements, is Annika Sörenstam a GolfPlayer?",Yes,Annika Sörenstam is a GolfPlayer.,True
572,Catherine Panton-Lewis winsAtLET List of golfers with most Ladies European Tour wins.,winsAtLET has domain GolfPlayer.,"Given the previous statements, is Catherine Panton-Lewis a GolfPlayer?",Yes,Catherine Panton-Lewis is a GolfPlayer.,True
573,Rawiri Waititi  Tenure  1 viceLeader Debbie Ngarewa-Packer.,viceLeader has domain PopulatedPlace.,"Given the previous statements, is Rawiri Waititi  Tenure  1 a PopulatedPlace?",Yes,Rawiri Waititi  Tenure  1 is a PopulatedPlace.,True
574,Russel Norman  Tenure  1 viceLeader Jeanette Fitzsimons.,viceLeader has domain PopulatedPlace.,"Given the previous statements, is Russel Norman  Tenure  1 a PopulatedPlace?",Yes,Russel Norman  Tenure  1 is a PopulatedPlace.,True
575,Russel Norman  Tenure  1 viceLeader Metiria Turei.,viceLeader has domain PopulatedPlace.,"Given the previous statements, is Russel Norman  Tenure  1 a PopulatedPlace?",Yes,Russel Norman  Tenure  1 is a PopulatedPlace.,True
576,Proton-M comparable Delta IV Heavy.,comparable has domain Rocket.,"Given the previous statements, is Proton-M a Rocket?",Yes,Proton-M is a Rocket.,True
577,Proton-M comparable Long March 5.,comparable has domain Rocket.,"Given the previous statements, is Proton-M a Rocket?",Yes,Proton-M is a Rocket.,True
578,Proton-M comparable H-IIB.,comparable has domain Rocket.,"Given the previous statements, is Proton-M a Rocket?",Yes,Proton-M is a Rocket.,True
579,Primitive ventricle organSystem Cardiovascular system.,organSystem has domain AnatomicalStructure.,"Given the previous statements, is Primitive ventricle an AnatomicalStructure?",Yes,Primitive ventricle is an AnatomicalStructure.,True
580,Basal plate organSystem Nervous system.,organSystem has domain AnatomicalStructure.,"Given the previous statements, is Basal plate an AnatomicalStructure?",Yes,Basal plate is an AnatomicalStructure.,True
581,Anterior cardinal vein organSystem Cardiovascular system.,organSystem has domain AnatomicalStructure.,"Given the previous statements, is Anterior cardinal vein an AnatomicalStructure?",Yes,Anterior cardinal vein is an AnatomicalStructure.,True
582,Canal Age riverBranchOf New York State Canal System.,riverBranchOf has domain River.,"Given the previous statements, is Canal Age a River?",Yes,Canal Age is a River.,True
583,Canal Henri IV riverBranchOf Canal de Briare.,riverBranchOf has domain River.,"Given the previous statements, is Canal Henri IV a River?",Yes,Canal Henri IV is a River.,True
584,Canal de Huningue riverBranchOf Canal du Rhône au Rhin.,riverBranchOf has domain River.,"Given the previous statements, is Canal de Huningue a River?",Yes,Canal de Huningue is a River.,True
585,Prayad Marksaeng winsAtAsia List of golfers with most Asian Tour wins.,winsAtAsia has domain GolfPlayer.,"Given the previous statements, is Prayad Marksaeng a GolfPlayer?",Yes,Prayad Marksaeng is a GolfPlayer.,True
586,Rory McIlroy winsAtAsia 2011 U.S. Open.,winsAtAsia has domain GolfPlayer.,"Given the previous statements, is Rory McIlroy a GolfPlayer?",Yes,Rory McIlroy is a GolfPlayer.,True
587,Scott Hend winsAtAsia List of golfers with most Asian Tour wins.,winsAtAsia has domain GolfPlayer.,"Given the previous statements, is Scott Hend a GolfPlayer?",Yes,Scott Hend is a GolfPlayer.,True
588,Patty Berg winsAtLPGA List of golfers with most LPGA Tour wins.,winsAtLPGA has domain GolfPlayer.,"Given the previous statements, is Patty Berg a GolfPlayer?",Yes,Patty Berg is a GolfPlayer.,True
589,Patty Tavatanakit winsAtLPGA 2021 ANA Inspiration.,winsAtLPGA has domain GolfPlayer.,"Given the previous statements, is Patty Tavatanakit a GolfPlayer?",Yes,Patty Tavatanakit is a GolfPlayer.,True
590,Annika Sörenstam winsAtLPGA List of golfers with most LPGA Tour wins.,winsAtLPGA has domain GolfPlayer.,"Given the previous statements, is Annika Sörenstam a GolfPlayer?",Yes,Annika Sörenstam is a GolfPlayer.,True
591,Royal Rumble brand Raw.,brand has domain WrestlingEvent.,"Given the previous statements, is Royal Rumble a WrestlingEvent?",Yes,Royal Rumble is a WrestlingEvent.,True
592,Royal Rumble brand SmackDown.,brand has domain WrestlingEvent.,"Given the previous statements, is Royal Rumble a WrestlingEvent?",Yes,Royal Rumble is a WrestlingEvent.,True
593,Royal Rumble brand Raw.,brand has domain WrestlingEvent.,"Given the previous statements, is Royal Rumble a WrestlingEvent?",Yes,Royal Rumble is a WrestlingEvent.,True
594,Cary Middlecoff winsAtPGA List of golfers with most PGA Tour wins.,winsAtPGA has domain GolfPlayer.,"Given the previous statements, is Cary Middlecoff a GolfPlayer?",Yes,Cary Middlecoff is a GolfPlayer.,True
595,Sam Snead winsAtPGA List of golfers with most PGA Tour wins.,winsAtPGA has domain GolfPlayer.,"Given the previous statements, is Sam Snead a GolfPlayer?",Yes,Sam Snead is a GolfPlayer.,True
596,Ben Hogan winsAtPGA List of golfers with most PGA Tour wins.,winsAtPGA has domain GolfPlayer.,"Given the previous statements, is Ben Hogan a GolfPlayer?",Yes,Ben Hogan is a GolfPlayer.,True
597,Caleb Fairley apprehended 1995-09-12.,apprehended has domain Criminal.,"Given the previous statements, is Caleb Fairley a Criminal?",Yes,Caleb Fairley is a Criminal.,True
598,Calvin Jackson apprehended 1974-09-12.,apprehended has domain Criminal.,"Given the previous statements, is Calvin Jackson a Criminal?",Yes,Calvin Jackson is a Criminal.,True
599,Camille Cléroux apprehended 2010-06-02.,apprehended has domain Criminal.,"Given the previous statements, is Camille Cléroux a Criminal?",Yes,Camille Cléroux is a Criminal.,True
600,Kamui Kobayashi  2019  1 carNumber 10.,carNumber has domain FormulaOneRacer.,"Given the previous statements, is Kamui Kobayashi  2019  1 a FormulaOneRacer?",Yes,Kamui Kobayashi  2019  1 is a FormulaOneRacer.,True
601,Kamui Kobayashi  2020  1 carNumber 10.,carNumber has domain FormulaOneRacer.,"Given the previous statements, is Kamui Kobayashi  2020  1 a FormulaOneRacer?",Yes,Kamui Kobayashi  2020  1 is a FormulaOneRacer.,True
602,Kamui Kobayashi  2021  1 carNumber 48.,carNumber has domain FormulaOneRacer.,"Given the previous statements, is Kamui Kobayashi  2021  1 a FormulaOneRacer?",Yes,Kamui Kobayashi  2021  1 is a FormulaOneRacer.,True
603,"Caleb Fairley criminalCharge Two counts ofaggravated assault,abuse of a corpse.",criminalCharge has domain Criminal.,"Given the previous statements, is Caleb Fairley a Criminal?",Yes,Caleb Fairley is a Criminal.,True
604,"Caleb Fairley criminalCharge Two counts ofmurder,robbery.",criminalCharge has domain Criminal.,"Given the previous statements, is Caleb Fairley a Criminal?",Yes,Caleb Fairley is a Criminal.,True
605,"Calisto Tanzi criminalCharge Fraud,fraudulent bankruptcy,criminal association.",criminalCharge has domain Criminal.,"Given the previous statements, is Calisto Tanzi a Criminal?",Yes,Calisto Tanzi is a Criminal.,True
606,1988 in spaceflight firstLaunch 1988-01-06.,firstLaunch has domain YearInSpaceflight.,"Given the previous statements, is 1988 in spaceflight a YearInSpaceflight?",Yes,1988 in spaceflight is a YearInSpaceflight.,True
607,1988 in spaceflight lastLaunch 1988-12-29.,lastLaunch has domain YearInSpaceflight.,"Given the previous statements, is 1988 in spaceflight a YearInSpaceflight?",Yes,1988 in spaceflight is a YearInSpaceflight.,True
608,Cannock Chase murders motive Rape.,motive has domain Criminal.,"Given the previous statements, is Cannock Chase murders a Criminal?",Yes,Cannock Chase murders is a Criminal.,True
609,Cannock Chase murders motive Child sexual abuse.,motive has domain Criminal.,"Given the previous statements, is Cannock Chase murders a Criminal?",Yes,Cannock Chase murders is a Criminal.,True
610,Carl Drega motive Long-term feud with government officials.,motive has domain Criminal.,"Given the previous statements, is Carl Drega a Criminal?",Yes,Carl Drega is a Criminal.,True
611,2020 dengue outbreak in Singapore severeCases 54.,severeCases has domain Outbreak.,"Given the previous statements, is 2020 dengue outbreak in Singapore an Outbreak?",Yes,2020 dengue outbreak in Singapore is an Outbreak.,True
612,1992-1993 Jack in the Box E. coli outbreak severeCases 178.,severeCases has domain Outbreak.,"Given the previous statements, is 1992-1993 Jack in the Box E. coli outbreak an Outbreak?",Yes,1992-1993 Jack in the Box E. coli outbreak is an Outbreak.,True
613,2011 Germany E. coli O104:H4 outbreak severeCases 800.,severeCases has domain Outbreak.,"Given the previous statements, is 2011 Germany E. coli O104:H4 outbreak an Outbreak?",Yes,2011 Germany E. coli O104:H4 outbreak is an Outbreak.,True
614,Cannabinoid receptor arm p.,arm has domain Protein.,"Given the previous statements, is Cannabinoid receptor a Protein?",Yes,Cannabinoid receptor is a Protein.,True
615,Cannabinoid receptor arm q.,arm has domain Protein.,"Given the previous statements, is Cannabinoid receptor a Protein?",Yes,Cannabinoid receptor is a Protein.,True
616,Amelogenin arm p.,arm has domain Protein.,"Given the previous statements, is Amelogenin a Protein?",Yes,Amelogenin is a Protein.,True
617,Cannabinoid receptor band 14.,band has domain Protein.,"Given the previous statements, is Cannabinoid receptor a Protein?",Yes,Cannabinoid receptor is a Protein.,True
618,Amelogenin band 11.,band has domain Protein.,"Given the previous statements, is Amelogenin a Protein?",Yes,Amelogenin is a Protein.,True
619,Amelogenin band 22.3.,band has domain Protein.,"Given the previous statements, is Amelogenin a Protein?",Yes,Amelogenin is a Protein.,True
620,Cannabinoid receptor chromosome 1.,chromosome has domain Protein.,"Given the previous statements, is Cannabinoid receptor a Protein?",Yes,Cannabinoid receptor is a Protein.,True
621,Cannabinoid receptor chromosome 6.,chromosome has domain Protein.,"Given the previous statements, is Cannabinoid receptor a Protein?",Yes,Cannabinoid receptor is a Protein.,True
622,Amelogenin chromosome Y.,chromosome has domain Protein.,"Given the previous statements, is Amelogenin a Protein?",Yes,Amelogenin is a Protein.,True
623,Cabeus depth 4000.0.,depth has domain Place.,"Given the previous statements, is Cabeus a Place?",Yes,Cabeus is a Place.,True
624,Cadillac station depth 12.2.,depth has domain Place.,"Given the previous statements, is Cadillac station a Place?",Yes,Cadillac station is a Place.,True
625,Cajal depth 1800.0.,depth has domain Place.,"Given the previous statements, is Cajal a Place?",Yes,Cajal is a Place.,True
626,Cannabinoid receptor entrezgene 1269.,entrezgene has domain Biomolecule.,"Given the previous statements, is Cannabinoid receptor a Biomolecule?",Yes,Cannabinoid receptor is a Biomolecule.,True
627,Cannabinoid receptor entrezgene 1268.,entrezgene has domain Biomolecule.,"Given the previous statements, is Cannabinoid receptor a Biomolecule?",Yes,Cannabinoid receptor is a Biomolecule.,True
628,Amelogenin entrezgene 265.,entrezgene has domain Biomolecule.,"Given the previous statements, is Amelogenin a Biomolecule?",Yes,Amelogenin is a Biomolecule.,True
